[
  {"provider":"六六云","plan_id":"liuliu-monthly-1000","plan_name":"月付 1000GB 档","price_cny":8,"billing_cycle":"monthly","traffic_gb":1000,"traffic_reset_rule":"unknown","validity_days":null,"device_limit":null,"observed_date":"2026-10","source_type":"user_historical_summary"},
  {"provider":"六六云","plan_id":"liuliu-onetime-1000","plan_name":"一次性 1000GB 档","price_cny":24,"billing_cycle":"one_time","traffic_gb":1000,"traffic_reset_rule":"fixed_total","validity_days":null,"device_limit":null,"observed_date":"2026-10","source_type":"user_historical_summary"},
  {"provider":"悦通","plan_id":"yuetong-mini-annual","plan_name":"Mini 年付","price_cny":69.9,"billing_cycle":"annual","traffic_gb":200,"traffic_reset_rule":"monthly","validity_days":null,"device_limit":null,"observed_date":"2026-10","source_type":"user_historical_summary"},
  {"provider":"星辰VPN","plan_id":"xingchen-monthly-80","plan_name":"月付 80GB 档","price_cny":8,"billing_cycle":"monthly","traffic_gb":80,"traffic_reset_rule":"unknown","validity_days":null,"device_limit":null,"observed_date":"2026-10","source_type":"user_historical_summary"},
  {"provider":"星辰VPN","plan_id":"xingchen-monthly-100","plan_name":"月付 100GB 档","price_cny":9.9,"billing_cycle":"monthly","traffic_gb":100,"traffic_reset_rule":"unknown","validity_days":null,"device_limit":null,"observed_date":"2026-10","source_type":"user_historical_summary"},
  {"provider":"星辰VPN","plan_id":"xingchen-monthly-200","plan_name":"月付 200GB 档","price_cny":17,"billing_cycle":"monthly","traffic_gb":200,"traffic_reset_rule":"unknown","validity_days":null,"device_limit":null,"observed_date":"2026-10","source_type":"user_historical_summary"},
  {"provider":"西游云","plan_id":"xiyou-monthly-120","plan_name":"月付 120GB 档","price_cny":9,"billing_cycle":"monthly","traffic_gb":120,"traffic_reset_rule":"unknown","validity_days":null,"device_limit":null,"observed_date":"2026-10","source_type":"user_historical_summary"},
  {"provider":"西游云","plan_id":"xiyou-monthly-200","plan_name":"月付 200GB 档","price_cny":16,"billing_cycle":"monthly","traffic_gb":200,"traffic_reset_rule":"unknown","validity_days":null,"device_limit":null,"observed_date":"2026-10","source_type":"user_historical_summary"},
  {"provider":"西游云","plan_id":"xiyou-monthly-500","plan_name":"月付 500GB 档","price_cny":38,"billing_cycle":"monthly","traffic_gb":500,"traffic_reset_rule":"unknown","validity_days":null,"device_limit":null,"observed_date":"2026-10","source_type":"user_historical_summary"},
  {"provider":"流光加速器","plan_id":"liuguang-monthly","plan_name":"月付档","price_cny":20,"billing_cycle":"monthly","traffic_gb":null,"traffic_reset_rule":"unknown","validity_days":null,"device_limit":null,"observed_date":"2026-10","source_type":"user_historical_summary"},
  {"provider":"流光加速器","plan_id":"liuguang-quarterly","plan_name":"季付档","price_cny":55,"billing_cycle":"quarterly","traffic_gb":null,"traffic_reset_rule":"unknown","validity_days":null,"device_limit":null,"observed_date":"2026-10","source_type":"user_historical_summary"},
  {"provider":"流光加速器","plan_id":"liuguang-semiannual","plan_name":"半年付档","price_cny":100,"billing_cycle":"semiannual","traffic_gb":null,"traffic_reset_rule":"unknown","validity_days":null,"device_limit":null,"observed_date":"2026-10","source_type":"user_historical_summary"},
  {"provider":"流光加速器","plan_id":"liuguang-annual","plan_name":"年付档","price_cny":180,"billing_cycle":"annual","traffic_gb":null,"traffic_reset_rule":"unknown","validity_days":null,"device_limit":null,"observed_date":"2026-10","source_type":"user_historical_summary"},
  {"provider":"山水云","plan_id":"shanshui-365d-128","plan_name":"365 天共 128GB","price_cny":39.9,"billing_cycle":"one_time","traffic_gb":128,"traffic_reset_rule":"fixed_total","validity_days":365,"device_limit":null,"observed_date":"2026-10","source_type":"user_historical_summary"},
  {"provider":"山水云","plan_id":"shanshui-365d-256","plan_name":"365 天共 256GB","price_cny":59.9,"billing_cycle":"one_time","traffic_gb":256,"traffic_reset_rule":"fixed_total","validity_days":365,"device_limit":null,"observed_date":"2026-10","source_type":"user_historical_summary"},
  {"provider":"魔戒","plan_id":"mojie-onetime-130","plan_name":"一次性 130GB","price_cny":19.9,"billing_cycle":"one_time","traffic_gb":130,"traffic_reset_rule":"fixed_total","validity_days":null,"device_limit":null,"observed_date":"2026-10","source_type":"user_historical_summary"},
  {"provider":"魔戒","plan_id":"mojie-onetime-210","plan_name":"一次性 210GB","price_cny":29.9,"billing_cycle":"one_time","traffic_gb":210,"traffic_reset_rule":"fixed_total","validity_days":null,"device_limit":null,"observed_date":"2026-10","source_type":"user_historical_summary"},
  {"provider":"魔戒","plan_id":"mojie-onetime-420","plan_name":"一次性 420GB","price_cny":52,"billing_cycle":"one_time","traffic_gb":420,"traffic_reset_rule":"fixed_total","validity_days":null,"device_limit":null,"observed_date":"2026-10","source_type":"user_historical_summary"},
  {"provider":"网际快车","plan_id":"wangji-onetime-20","plan_name":"一次性 20GB","price_cny":6.8,"billing_cycle":"one_time","traffic_gb":20,"traffic_reset_rule":"fixed_total","validity_days":null,"device_limit":null,"observed_date":"2026-10","source_type":"user_historical_summary"},
  {"provider":"SKYLUMO","plan_id":"skylumo-monthly-60","plan_name":"基础月付 60GB","price_cny":6.99,"billing_cycle":"monthly","traffic_gb":60,"traffic_reset_rule":"unknown","validity_days":null,"device_limit":null,"observed_date":"2026-10","source_type":"user_historical_summary"},
  {"provider":"星岛梦","plan_id":"xingdaomeng-monthly-150","plan_name":"月付 150GB 档","price_cny":25,"billing_cycle":"monthly","traffic_gb":150,"traffic_reset_rule":"unknown","validity_days":null,"device_limit":null,"observed_date":"2026-10","source_type":"user_historical_summary"},
  {"provider":"星岛梦","plan_id":"xingdaomeng-monthly-300","plan_name":"月付 300GB 档","price_cny":50,"billing_cycle":"monthly","traffic_gb":300,"traffic_reset_rule":"unknown","validity_days":null,"device_limit":null,"observed_date":"2026-10","source_type":"user_historical_summary"},
  {"provider":"星岛梦","plan_id":"xingdaomeng-monthly-500","plan_name":"月付 500GB 档","price_cny":70,"billing_cycle":"monthly","traffic_gb":500,"traffic_reset_rule":"unknown","validity_days":null,"device_limit":null,"observed_date":"2026-10","source_type":"user_historical_summary"},
  {"provider":"星岛梦","plan_id":"xingdaomeng-monthly-1tb","plan_name":"月付 1TB 档","price_cny":130,"billing_cycle":"monthly","traffic_gb":null,"traffic_reset_rule":"unknown","validity_days":null,"device_limit":null,"observed_date":"2026-10","source_type":"user_historical_summary","traffic_label":"1TB"}
]
